<?xml version="1.0" encoding="UTF-8" ?>
<!-- 
Copyright 2015 George Belden

This file is part of CFGReader.

CFGReader is free software: you can redistribute it and/or modify it under the terms of the GNU General Public License as published by the Free Software Foundation, either version 3 of the License, or (at your option) any later version.

CFGReader is distributed in the hope that it will be useful, but WITHOUT ANY WARRANTY; without even the implied warranty of MERCHANTABILITY or FITNESS FOR A PARTICULAR PURPOSE.  See the GNU General Public License for more details.

You should have received a copy of the GNU General Public License along with CFGReader.  If not, see <http://www.gnu.org/licenses/>.
 -->
<ContextFreeGrammar first-rule="Sentence"
	xmlns:xsi="http://www.w3.org/2001/XMLSchema-instance"
	xsi:noNamespaceSchemaLocation="CFG.xsd">
	<Rule non-terminal="Sentence">
		<Expansion>
			<Production symbol="NounPhrase" type="NonTerminal" />
			<Production symbol="VerbPhrase" type="NonTerminal" />
		</Expansion>
	</Rule>
	<Rule non-terminal="NounPhrase">
		<Expansion>
			<Production symbol="Article" type="Terminal" />
			<Production symbol="Noun" type="Terminal" />
		</Expansion>
		<Expansion>
			<Production symbol="Noun" type="Terminal" />
		</Expansion>
	</Rule>
	<Rule non-terminal="VerbPhrase">
		<Expansion>
			<Production symbol="Verb" type="Terminal" />
		</Expansion>
		<Expansion>
			<Production symbol="Verb" type="Terminal" />
			<Production symbol="NounPhrase" type="NonTerminal" />
		</Expansion>
	</Rule>
</ContextFreeGrammar>